{
  "artifact_archive_bindings": [
    {
      "archive_sha256": "b2b2f62431d1fbee8f353f2df4c7da5478ee492232704ef4cd051a1cc3585936",
      "artifact_id": 9700517368,
      "created_at": "2026-08-28T20:26:18Z",
      "name": "historical-public-image-candidate",
      "size_in_bytes": 3467
    },
    {
      "archive_sha256": "894687735dd841e4f38fe2f5d1e5da731bb34fdb86ead0ab8055c196e402c8f2",
      "artifact_id": 9700559300,
      "created_at": "2026-08-28T20:27:49Z",
      "name": "historical-public-staging-qualification",
      "size_in_bytes": 1212
    }
  ],
  "artifact_file_sha256": {
    "candidate-binding.json": "f197529880f6db421c976856e8568b6af25096d6f4d9599569fac8d7e4a5bed6",
    "historical-image-publication.json": "076f05c70c0802ad54dd18fcc22ba119ffa3ca4011286c4b896e1a7196a86a76",
    "historical-public-staging-qualification.json": "e71bdb0d64ec5614d69cfca69950c35d410376a1a375d91027742aa0206ab1f7",
    "historical-qualification-rollout.json": "e45f59f9160182f3a9143f06c619b15772ca2038be933364422b17c4643da8da"
  },
  "artifact_provenance_sha256": "b1f1485a71cf093351bd77ad4555a2ea032427003b82405fceb95bb2d5027e1a",
  "benchmark_commit": "9921ef5c57b8d9eaa31b64a7e2d68cf53a388c66",
  "benchmark_repository": "leanprover/lean-eval",
  "benchmark_tree": "e6cd8bfdc43fe3e4293363c2c0656bd9c9c77efd",
  "controller_source_commit": "7eb77aa8c2ef7f4d598c77240ea9effbb248dce2",
  "execution_profile": {
    "architecture": "x86_64",
    "cache_state": "cold",
    "components": {
      "comparator": {
        "commit": "71b52ec29e06d4b7d882726553b1ceb99a2499e0",
        "repository": "leanprover/comparator"
      },
      "landrun": {
        "commit": "5ed4a3db3a4ad930d577215c6b9abaa19df7f99f",
        "repository": "zouuup/landrun"
      },
      "lean4export": {
        "commit": "12581a6b680d8478175596338eb2d53383a323e3",
        "repository": "leanprover/lean4export"
      },
      "nanoda": {
        "commit": "68d5ca9db226849b41a6fff59d796ff19d0a8840",
        "repository": "robsimmons/nanoda_lib"
      }
    },
    "cpu_model": "AMD EPYC",
    "go_toolchain": "go1.25.12",
    "kernel_release": "6.18.36-cloudflare-firecracker-2026.6.17",
    "measurement_command": [
      "/opt/lean-eval/replay-measure"
    ],
    "runner_profile": "cloudflare-sandbox-standard-4-v1",
    "rust_toolchain": "rustc-1.89.0",
    "schema_version": 1,
    "toolchain": "leanprover/lean4:v4.30.0-rc2",
    "vm_image_digest": "sha256:495c588091249a366087d1b6919ac27cbb76bc617f73aa5bfef6c5e22403f755"
  },
  "execution_profile_digest": "133e307550d669fe50956c19e40d73f4ce2e3ed611b5b269edb050d6dfcf48e0",
  "image_source_commit": "7eb77aa8c2ef7f4d598c77240ea9effbb248dce2",
  "kind": "historical_public_replay_profile_qualification",
  "measurement_config": {
    "memory_limit_bytes": 12884901888,
    "retired_instructions": {
      "perf_event": "instructions:u",
      "required": false
    },
    "schema_version": 1,
    "wall_time_limit_ms": 19800000
  },
  "measurement_config_digest": "2dfc898270b83b6c99689e3f551a102c5e76636ec9f469a408498080e3e45945",
  "plan_commit": "7eb77aa8c2ef7f4d598c77240ea9effbb248dce2",
  "plan_path": "evidence/public-replay/plans/d6e81393c37138f7928435e1e68235165dba6d9aab01698edae66acd6f08120e.json",
  "plan_repository": "leanprover/lean-eval-submissions",
  "plan_sha256": "d6e81393c37138f7928435e1e68235165dba6d9aab01698edae66acd6f08120e",
  "profile_matrix_path": "configuration/historical-public-replay-profile-matrix-v1.json",
  "profile_matrix_sha256": "a674707eea7a9556576c8dcbe57bcf6b4f44362d2bdfd47895fb7c783554f39c",
  "qualification_contract_path": "historical-public-qualification/contract-v1.json",
  "qualification_contract_sha256": "937a1ce9800350de47fb2ce0c3d276b6cddc38cd39820727c8b8687bea89dad0",
  "qualification_controller_sha256": "d13edde113de5a8d45e967ebaef9bff864c9f076f0e7e7c09db3d48bcd95bcd7",
  "qualification_status": "qualified",
  "qualification_workflow_sha256": "39dd306ef71badded662cb25f4d040880822d4cea19285aa468fb75faf493bb5",
  "registry_manifest_digest": "sha256:495c588091249a366087d1b6919ac27cbb76bc617f73aa5bfef6c5e22403f755",
  "registry_repository": "lean-eval-historical-public-v1",
  "registry_tag": "9921ef5c57b8d9eaa31b64a7e2d68cf53a388c66-7eb77aa8c2ef7f4d598c77240ea9effbb248dce2",
  "runner_contract_path": "configuration/historical-public-runner-v1.json",
  "runner_contract_sha256": "6d341a642dfd6aa9092228269da6761000bf0818128ce3f35cb259bd8fb2303f",
  "schema_version": 1,
  "workflow_path": ".github/workflows/historical-public-image-qualification.yml",
  "workflow_repository": "leanprover/lean-eval-submissions",
  "workflow_run_attempt": 1,
  "workflow_run_id": 33207421846
}
