{
  "artifact_archive_bindings": [
    {
      "archive_sha256": "994d7d6ebe673e2339cdfac8c342be54d097e812df4a2c214ebcd7ad5a850609",
      "artifact_id": 9593355418,
      "created_at": "2026-08-26T04:47:07Z",
      "name": "historical-public-image-candidate",
      "size_in_bytes": 3473
    },
    {
      "archive_sha256": "1a7834e2f92003023162c39f14c7a6e6fd8220154eec86db535ae6a6f54db2ed",
      "artifact_id": 9593387625,
      "created_at": "2026-08-26T04:48:39Z",
      "name": "historical-public-staging-qualification",
      "size_in_bytes": 1214
    }
  ],
  "artifact_file_sha256": {
    "candidate-binding.json": "15ef1805c3fd1829e331b68efbec017e7de1b9630c71ceba804aef49a212415f",
    "historical-image-publication.json": "8f704906929d314aeced634b9bf197335964006bd521bc4dcbdd48d12afced66",
    "historical-public-staging-qualification.json": "4465b9a72cb732c50f78109ccc60ff57c8baf5f969b3fd9ae99e902134462bd5",
    "historical-qualification-rollout.json": "c622b425b9a0332e49e155f84975e4d61ea3f2cee09cac50464fbaf080ae5c01"
  },
  "artifact_provenance_sha256": "7c0704accc51941435902955facc11dc12e2ae2a3260bc214cde256945e7e681",
  "benchmark_commit": "ed29f457a31e34008769b4c068935b80024bcdb4",
  "benchmark_repository": "leanprover/lean-eval",
  "benchmark_tree": "f4d3e1343df467a06f040fa16347c31ed37e8371",
  "controller_source_commit": "7eb77aa8c2ef7f4d598c77240ea9effbb248dce2",
  "execution_profile": {
    "architecture": "x86_64",
    "cache_state": "cold",
    "components": {
      "comparator": {
        "commit": "71b52ec29e06d4b7d882726553b1ceb99a2499e0",
        "repository": "leanprover/comparator"
      },
      "landrun": {
        "commit": "5ed4a3db3a4ad930d577215c6b9abaa19df7f99f",
        "repository": "zouuup/landrun"
      },
      "lean4export": {
        "commit": "15f6055e299ad5b89345e533cc2192f4cc00f659",
        "repository": "leanprover/lean4export"
      },
      "nanoda": {
        "commit": "68d5ca9db226849b41a6fff59d796ff19d0a8840",
        "repository": "robsimmons/nanoda_lib"
      }
    },
    "cpu_model": "AMD EPYC",
    "go_toolchain": "go1.25.12",
    "kernel_release": "6.18.36-cloudflare-firecracker-2026.6.17",
    "measurement_command": [
      "/opt/lean-eval/replay-measure"
    ],
    "runner_profile": "cloudflare-sandbox-standard-4-v1",
    "rust_toolchain": "rustc-1.89.0",
    "schema_version": 1,
    "toolchain": "leanprover/lean4:v4.33.0",
    "vm_image_digest": "sha256:204944338e2c7939701453a7c593ac1f1c290ede6bc1e5973819fe196dbbd356"
  },
  "execution_profile_digest": "dd37e9df6ff89dde2225b5fe62a833f6772c15b7ff244dcd373721bdc126bd71",
  "image_source_commit": "7eb77aa8c2ef7f4d598c77240ea9effbb248dce2",
  "kind": "historical_public_replay_profile_qualification",
  "measurement_config": {
    "memory_limit_bytes": 12884901888,
    "retired_instructions": {
      "perf_event": "instructions:u",
      "required": false
    },
    "schema_version": 1,
    "wall_time_limit_ms": 19800000
  },
  "measurement_config_digest": "2dfc898270b83b6c99689e3f551a102c5e76636ec9f469a408498080e3e45945",
  "plan_commit": "7eb77aa8c2ef7f4d598c77240ea9effbb248dce2",
  "plan_path": "evidence/public-replay/plans/d6e81393c37138f7928435e1e68235165dba6d9aab01698edae66acd6f08120e.json",
  "plan_repository": "leanprover/lean-eval-submissions",
  "plan_sha256": "d6e81393c37138f7928435e1e68235165dba6d9aab01698edae66acd6f08120e",
  "profile_matrix_path": "configuration/historical-public-replay-profile-matrix-v1.json",
  "profile_matrix_sha256": "a674707eea7a9556576c8dcbe57bcf6b4f44362d2bdfd47895fb7c783554f39c",
  "qualification_contract_path": "historical-public-qualification/contract-v1.json",
  "qualification_contract_sha256": "937a1ce9800350de47fb2ce0c3d276b6cddc38cd39820727c8b8687bea89dad0",
  "qualification_controller_sha256": "d13edde113de5a8d45e967ebaef9bff864c9f076f0e7e7c09db3d48bcd95bcd7",
  "qualification_status": "qualified",
  "qualification_workflow_sha256": "39dd306ef71badded662cb25f4d040880822d4cea19285aa468fb75faf493bb5",
  "registry_manifest_digest": "sha256:204944338e2c7939701453a7c593ac1f1c290ede6bc1e5973819fe196dbbd356",
  "registry_repository": "lean-eval-historical-public-v1",
  "registry_tag": "ed29f457a31e34008769b4c068935b80024bcdb4-7eb77aa8c2ef7f4d598c77240ea9effbb248dce2",
  "runner_contract_path": "configuration/historical-public-runner-v1.json",
  "runner_contract_sha256": "6d341a642dfd6aa9092228269da6761000bf0818128ce3f35cb259bd8fb2303f",
  "schema_version": 1,
  "workflow_path": ".github/workflows/historical-public-image-qualification.yml",
  "workflow_repository": "leanprover/lean-eval-submissions",
  "workflow_run_attempt": 1,
  "workflow_run_id": 32931390110
}
