{
  "artifact_archive_bindings": [
    {
      "archive_sha256": "f0db66d52b1f4951d8955ec70357a685ba8b8c94428de383043bdbf19645aff0",
      "artifact_id": 9555774423,
      "created_at": "2026-08-25T08:46:57Z",
      "name": "historical-public-image-candidate",
      "size_in_bytes": 3464
    },
    {
      "archive_sha256": "63f5cefc061320ac22d5b476489ee0d92f9012721c60fbf0b5769822b6373851",
      "artifact_id": 9555822844,
      "created_at": "2026-08-25T08:48:27Z",
      "name": "historical-public-staging-qualification",
      "size_in_bytes": 1206
    }
  ],
  "artifact_file_sha256": {
    "candidate-binding.json": "308f6bb51a13743d6cd7ca44f0020be9702f58ddac6039e8c822cdff74b1ffd0",
    "historical-image-publication.json": "c9268d205a2c7f2bf89ef00c4352e956f179d13de9f6ff63c26b6343d0805274",
    "historical-public-staging-qualification.json": "0d6435bfc8b1117fc12d764e3c9136176344d580f09ead25b11605310def9748",
    "historical-qualification-rollout.json": "8f98e52da0874958f842213a50ad883cddd5b534bab4b7af3e753c29655d900f"
  },
  "artifact_provenance_sha256": "15bd88559565a9924e6f7c73e0740ee9c69dd7f445a8374acb3d4c43bf53bf13",
  "benchmark_commit": "7699436464052268e6c04b41554bfbc2c6908ec5",
  "benchmark_repository": "leanprover/lean-eval",
  "benchmark_tree": "0074a0fc513fe20f15094a389efbbb056df82817",
  "controller_source_commit": "7eb77aa8c2ef7f4d598c77240ea9effbb248dce2",
  "execution_profile": {
    "architecture": "x86_64",
    "cache_state": "cold",
    "components": {
      "comparator": {
        "commit": "71b52ec29e06d4b7d882726553b1ceb99a2499e0",
        "repository": "leanprover/comparator"
      },
      "landrun": {
        "commit": "5ed4a3db3a4ad930d577215c6b9abaa19df7f99f",
        "repository": "zouuup/landrun"
      },
      "lean4export": {
        "commit": "15f6055e299ad5b89345e533cc2192f4cc00f659",
        "repository": "leanprover/lean4export"
      },
      "nanoda": {
        "commit": "68d5ca9db226849b41a6fff59d796ff19d0a8840",
        "repository": "robsimmons/nanoda_lib"
      }
    },
    "cpu_model": "AMD EPYC",
    "go_toolchain": "go1.25.12",
    "kernel_release": "6.18.36-cloudflare-firecracker-2026.6.17",
    "measurement_command": [
      "/opt/lean-eval/replay-measure"
    ],
    "runner_profile": "cloudflare-sandbox-standard-4-v1",
    "rust_toolchain": "rustc-1.89.0",
    "schema_version": 1,
    "toolchain": "leanprover/lean4:v4.33.0",
    "vm_image_digest": "sha256:1a1eef8430e7a8fe1ebf9a541f7c6f3e89b8abac8c60669bc58778b0269e8d41"
  },
  "execution_profile_digest": "aa77825080d98f85cce959cb48ba0bd4f2f847391a81ae3dd58c82f1e047c7f9",
  "image_source_commit": "7eb77aa8c2ef7f4d598c77240ea9effbb248dce2",
  "kind": "historical_public_replay_profile_qualification",
  "measurement_config": {
    "memory_limit_bytes": 12884901888,
    "retired_instructions": {
      "perf_event": "instructions:u",
      "required": false
    },
    "schema_version": 1,
    "wall_time_limit_ms": 19800000
  },
  "measurement_config_digest": "2dfc898270b83b6c99689e3f551a102c5e76636ec9f469a408498080e3e45945",
  "plan_commit": "7eb77aa8c2ef7f4d598c77240ea9effbb248dce2",
  "plan_path": "evidence/public-replay/plans/d6e81393c37138f7928435e1e68235165dba6d9aab01698edae66acd6f08120e.json",
  "plan_repository": "leanprover/lean-eval-submissions",
  "plan_sha256": "d6e81393c37138f7928435e1e68235165dba6d9aab01698edae66acd6f08120e",
  "profile_matrix_path": "configuration/historical-public-replay-profile-matrix-v1.json",
  "profile_matrix_sha256": "a674707eea7a9556576c8dcbe57bcf6b4f44362d2bdfd47895fb7c783554f39c",
  "qualification_contract_path": "historical-public-qualification/contract-v1.json",
  "qualification_contract_sha256": "937a1ce9800350de47fb2ce0c3d276b6cddc38cd39820727c8b8687bea89dad0",
  "qualification_controller_sha256": "d13edde113de5a8d45e967ebaef9bff864c9f076f0e7e7c09db3d48bcd95bcd7",
  "qualification_status": "qualified",
  "qualification_workflow_sha256": "39dd306ef71badded662cb25f4d040880822d4cea19285aa468fb75faf493bb5",
  "registry_manifest_digest": "sha256:1a1eef8430e7a8fe1ebf9a541f7c6f3e89b8abac8c60669bc58778b0269e8d41",
  "registry_repository": "lean-eval-historical-public-v1",
  "registry_tag": "7699436464052268e6c04b41554bfbc2c6908ec5-7eb77aa8c2ef7f4d598c77240ea9effbb248dce2",
  "runner_contract_path": "configuration/historical-public-runner-v1.json",
  "runner_contract_sha256": "6d341a642dfd6aa9092228269da6761000bf0818128ce3f35cb259bd8fb2303f",
  "schema_version": 1,
  "workflow_path": ".github/workflows/historical-public-image-qualification.yml",
  "workflow_repository": "leanprover/lean-eval-submissions",
  "workflow_run_attempt": 1,
  "workflow_run_id": 32827667191
}
