{
  "artifact_archive_bindings": [
    {
      "archive_sha256": "9cf10596c6e312b2525141cc013332aa45d6437d67cbe79a594cfdac2a3d9ec9",
      "artifact_id": 9552895400,
      "created_at": "2026-08-25T07:12:22Z",
      "name": "historical-public-image-candidate",
      "size_in_bytes": 3467
    },
    {
      "archive_sha256": "c9ea3641eacbc98309d96623884571073f2257056927ef7a98ade021bb946960",
      "artifact_id": 9552938296,
      "created_at": "2026-08-25T07:13:57Z",
      "name": "historical-public-staging-qualification",
      "size_in_bytes": 1212
    }
  ],
  "artifact_file_sha256": {
    "candidate-binding.json": "70bdc5441b00298097d864f7042411b2ab6979e46e35cd0e2fd8e2d842311446",
    "historical-image-publication.json": "69398ae5e679978ee4aa398ce41c4665150c5744bac26f29e32c55679f000ffb",
    "historical-public-staging-qualification.json": "e81c1adde75aad04493802aadf82d47e01e8411defac67a4e33379d502e1b4d0",
    "historical-qualification-rollout.json": "fd30a6e79f9134e1ff748abe8c3f487fe2ca98e96fb33205820c9dc925a59068"
  },
  "artifact_provenance_sha256": "03e05fd603a36a0c277cf8e86438406f137b0ffe3e762117be06e129e09f713d",
  "benchmark_commit": "53348531969dc984e02e3be0379a7282c664abd9",
  "benchmark_repository": "leanprover/lean-eval",
  "benchmark_tree": "ddd50ebc73256b7f4b426d8f3705c77fba6af633",
  "controller_source_commit": "7eb77aa8c2ef7f4d598c77240ea9effbb248dce2",
  "execution_profile": {
    "architecture": "x86_64",
    "cache_state": "cold",
    "components": {
      "comparator": {
        "commit": "71b52ec29e06d4b7d882726553b1ceb99a2499e0",
        "repository": "leanprover/comparator"
      },
      "landrun": {
        "commit": "5ed4a3db3a4ad930d577215c6b9abaa19df7f99f",
        "repository": "zouuup/landrun"
      },
      "lean4export": {
        "commit": "86e4a339507466921dc8c5417c8cb1de1ce7df60",
        "repository": "leanprover/lean4export"
      },
      "nanoda": {
        "commit": "68d5ca9db226849b41a6fff59d796ff19d0a8840",
        "repository": "robsimmons/nanoda_lib"
      }
    },
    "cpu_model": "AMD EPYC",
    "go_toolchain": "go1.25.12",
    "kernel_release": "6.18.36-cloudflare-firecracker-2026.6.17",
    "measurement_command": [
      "/opt/lean-eval/replay-measure"
    ],
    "runner_profile": "cloudflare-sandbox-standard-4-v1",
    "rust_toolchain": "rustc-1.89.0",
    "schema_version": 1,
    "toolchain": "leanprover/lean4:v4.32.2",
    "vm_image_digest": "sha256:94e6812a52e1f4208f375fc28f93efb3b25a583cecaaa3c05c9e05b71f978cad"
  },
  "execution_profile_digest": "7556b12702b66864bacf6c1745a99834ad620e8342035e031105001d8c9b45e6",
  "image_source_commit": "7eb77aa8c2ef7f4d598c77240ea9effbb248dce2",
  "kind": "historical_public_replay_profile_qualification",
  "measurement_config": {
    "memory_limit_bytes": 12884901888,
    "retired_instructions": {
      "perf_event": "instructions:u",
      "required": false
    },
    "schema_version": 1,
    "wall_time_limit_ms": 19800000
  },
  "measurement_config_digest": "2dfc898270b83b6c99689e3f551a102c5e76636ec9f469a408498080e3e45945",
  "plan_commit": "7eb77aa8c2ef7f4d598c77240ea9effbb248dce2",
  "plan_path": "evidence/public-replay/plans/d6e81393c37138f7928435e1e68235165dba6d9aab01698edae66acd6f08120e.json",
  "plan_repository": "leanprover/lean-eval-submissions",
  "plan_sha256": "d6e81393c37138f7928435e1e68235165dba6d9aab01698edae66acd6f08120e",
  "profile_matrix_path": "configuration/historical-public-replay-profile-matrix-v1.json",
  "profile_matrix_sha256": "a674707eea7a9556576c8dcbe57bcf6b4f44362d2bdfd47895fb7c783554f39c",
  "qualification_contract_path": "historical-public-qualification/contract-v1.json",
  "qualification_contract_sha256": "937a1ce9800350de47fb2ce0c3d276b6cddc38cd39820727c8b8687bea89dad0",
  "qualification_controller_sha256": "d13edde113de5a8d45e967ebaef9bff864c9f076f0e7e7c09db3d48bcd95bcd7",
  "qualification_status": "qualified",
  "qualification_workflow_sha256": "39dd306ef71badded662cb25f4d040880822d4cea19285aa468fb75faf493bb5",
  "registry_manifest_digest": "sha256:94e6812a52e1f4208f375fc28f93efb3b25a583cecaaa3c05c9e05b71f978cad",
  "registry_repository": "lean-eval-historical-public-v1",
  "registry_tag": "53348531969dc984e02e3be0379a7282c664abd9-7eb77aa8c2ef7f4d598c77240ea9effbb248dce2",
  "runner_contract_path": "configuration/historical-public-runner-v1.json",
  "runner_contract_sha256": "6d341a642dfd6aa9092228269da6761000bf0818128ce3f35cb259bd8fb2303f",
  "schema_version": 1,
  "workflow_path": ".github/workflows/historical-public-image-qualification.yml",
  "workflow_repository": "leanprover/lean-eval-submissions",
  "workflow_run_attempt": 1,
  "workflow_run_id": 32819593286
}
