{
  "artifact_archive_bindings": [
    {
      "archive_sha256": "543adba068022ade2ba3c975a35f3fabdc28717113e134b5ae7c4b9d5acd204a",
      "artifact_id": 9548279688,
      "created_at": "2026-08-25T03:46:02Z",
      "name": "historical-public-image-candidate",
      "size_in_bytes": 3467
    },
    {
      "archive_sha256": "d1aa8fcf1204d88440a34ee473f36c175ce18a4d2e24c3c23a4bbbbd29c3a18f",
      "artifact_id": 9548310791,
      "created_at": "2026-08-25T03:47:34Z",
      "name": "historical-public-staging-qualification",
      "size_in_bytes": 1210
    }
  ],
  "artifact_file_sha256": {
    "candidate-binding.json": "e29fc6b34bf4005deae60af14de78715a26e8c3a14719574941599af94fa6bf7",
    "historical-image-publication.json": "149e4d407b5b3a856f79d812661ccc856c310810679bfdfa3e54e55492cde9ed",
    "historical-public-staging-qualification.json": "c73cf2bccec5b6f04a9f7a2f69cb1308dc7aecf1f873ce3df6e68b3f3028ffb6",
    "historical-qualification-rollout.json": "4262a019fa0f295e3c5d0e65b2207ce0fbe8a3243fb07ac288c8c14a6d570488"
  },
  "artifact_provenance_sha256": "0f3a29b4781240fe3cb1d63d875509a6726ae2e5932ad0d5a5be2756e1843d0b",
  "benchmark_commit": "126de1f3e6b053a0e8a7f67681045804cf12712e",
  "benchmark_repository": "leanprover/lean-eval",
  "benchmark_tree": "a50b8ca1be6e04628df1a2142acb5488139b3213",
  "controller_source_commit": "7eb77aa8c2ef7f4d598c77240ea9effbb248dce2",
  "execution_profile": {
    "architecture": "x86_64",
    "cache_state": "cold",
    "components": {
      "comparator": {
        "commit": "71b52ec29e06d4b7d882726553b1ceb99a2499e0",
        "repository": "leanprover/comparator"
      },
      "landrun": {
        "commit": "5ed4a3db3a4ad930d577215c6b9abaa19df7f99f",
        "repository": "zouuup/landrun"
      },
      "lean4export": {
        "commit": "12581a6b680d8478175596338eb2d53383a323e3",
        "repository": "leanprover/lean4export"
      },
      "nanoda": {
        "commit": "68d5ca9db226849b41a6fff59d796ff19d0a8840",
        "repository": "robsimmons/nanoda_lib"
      }
    },
    "cpu_model": "AMD EPYC",
    "go_toolchain": "go1.25.12",
    "kernel_release": "6.18.36-cloudflare-firecracker-2026.6.17",
    "measurement_command": [
      "/opt/lean-eval/replay-measure"
    ],
    "runner_profile": "cloudflare-sandbox-standard-4-v1",
    "rust_toolchain": "rustc-1.89.0",
    "schema_version": 1,
    "toolchain": "leanprover/lean4:v4.30.0-rc2",
    "vm_image_digest": "sha256:45047d508d822c808bc05a06f571fa94f35b8be6fd89f2d0de77c12c6cc6b9d8"
  },
  "execution_profile_digest": "9e41d7b0a5e77d488fd023b7b3ffc2caedf72b0e0e3aea0dcb0c91da5c4bbfe5",
  "image_source_commit": "7eb77aa8c2ef7f4d598c77240ea9effbb248dce2",
  "kind": "historical_public_replay_profile_qualification",
  "measurement_config": {
    "memory_limit_bytes": 12884901888,
    "retired_instructions": {
      "perf_event": "instructions:u",
      "required": false
    },
    "schema_version": 1,
    "wall_time_limit_ms": 19800000
  },
  "measurement_config_digest": "2dfc898270b83b6c99689e3f551a102c5e76636ec9f469a408498080e3e45945",
  "plan_commit": "7eb77aa8c2ef7f4d598c77240ea9effbb248dce2",
  "plan_path": "evidence/public-replay/plans/d6e81393c37138f7928435e1e68235165dba6d9aab01698edae66acd6f08120e.json",
  "plan_repository": "leanprover/lean-eval-submissions",
  "plan_sha256": "d6e81393c37138f7928435e1e68235165dba6d9aab01698edae66acd6f08120e",
  "profile_matrix_path": "configuration/historical-public-replay-profile-matrix-v1.json",
  "profile_matrix_sha256": "a674707eea7a9556576c8dcbe57bcf6b4f44362d2bdfd47895fb7c783554f39c",
  "qualification_contract_path": "historical-public-qualification/contract-v1.json",
  "qualification_contract_sha256": "937a1ce9800350de47fb2ce0c3d276b6cddc38cd39820727c8b8687bea89dad0",
  "qualification_controller_sha256": "d13edde113de5a8d45e967ebaef9bff864c9f076f0e7e7c09db3d48bcd95bcd7",
  "qualification_status": "qualified",
  "qualification_workflow_sha256": "39dd306ef71badded662cb25f4d040880822d4cea19285aa468fb75faf493bb5",
  "registry_manifest_digest": "sha256:45047d508d822c808bc05a06f571fa94f35b8be6fd89f2d0de77c12c6cc6b9d8",
  "registry_repository": "lean-eval-historical-public-v1",
  "registry_tag": "126de1f3e6b053a0e8a7f67681045804cf12712e-7eb77aa8c2ef7f4d598c77240ea9effbb248dce2",
  "runner_contract_path": "configuration/historical-public-runner-v1.json",
  "runner_contract_sha256": "6d341a642dfd6aa9092228269da6761000bf0818128ce3f35cb259bd8fb2303f",
  "schema_version": 1,
  "workflow_path": ".github/workflows/historical-public-image-qualification.yml",
  "workflow_repository": "leanprover/lean-eval-submissions",
  "workflow_run_attempt": 1,
  "workflow_run_id": 32805627401
}
